{
  "$schema": "./reuse-plan-validation-result.schema.v0.1.json",
  "result_id": "CE-G13-REUSE-PLAN-VALIDATION-ATTEMPT-001",
  "status": "PASS",
  "session_reference": "CE-G13-S03",
  "source_snapshot_sha256": "48039a10b3542c49a89b4ba9353360b378300c570f42c7ebf0bf6595abbb7548",
  "checks": {
    "machine_status_entry_resolvable": true,
    "architecture_entry_resolvable": true,
    "evaluation_package_resolvable": true,
    "synthetic_input_resolvable": true,
    "procedure_bounded": true,
    "website_only": true,
    "hidden_dependencies_absent": true
  },
  "failures": [],
  "effects": {
    "runtime_started": false,
    "agent_created": false,
    "permission_granted": false,
    "customer_adoption": false,
    "production_ready": false
  }
}
